Title,Category,Opinions
"Kupujemy coraz mniej rosyjskiej ropy","Gospodarka","0"
"Dlaczego nastąpił cud gospodarczy Japonii?","Gospodarka","0"
"Dlaczego skończył się cud gospodarczy Japonii?","Gospodarka","0"
"W poszukiwaniu wyższej inflacji","Gospodarka","0"
"Włochy na skraju recesji, Turcja w kryzysie, a Polska z nadmiernym deficytem","Gospodarka","0"
"Potrzebujemy nowego otwarcia we współpracy z Niemcami","Gospodarka","0"
"Potrzebujemy nowego otwarcia we współpracy z Niemcami","Gospodarka","0"
"Polska przeznaczy 140 mld złotych na energię odnawialną","Gospodarka","0"
"Wysoka produkcja przemysłowa w Polsce. Znacznie powyżej prognoz ekonomistów","Gospodarka","0"
"Przemysł nie przejmuje się ogłaszanym przez ekonomistów potencjalnym spowolnieniem","Gospodarka","0"
"Rosną ceny produktów rolnych. Przełoży się to na ceny żywności","Gospodarka","0"
"Polska w G20? Są na to szanse","Gospodarka","0"
"Coraz więcej pracujących emerytów. To dobra wiadomość","Gospodarka","0"
"Fitch podnosi prognozy wzrostu gospodarczego dla Polski","Gospodarka","0"
"Nastroje w przemyśle nie poprawiają się. PMI po raz kolejny poniżej 50 punktów","Gospodarka","0"
"Pomimo wysokiej konsumpcji, inflacja w Polsce ciągle na stosunkowo niskim poziomie","Gospodarka","0"
"Bezrobocie: najlepsze dane za luty od początku transformacji gospodarczej","Gospodarka","0"
"Dane handlowe za styczeń. Pierwszy raz od maja eksport rósł szybciej niż import","Gospodarka","0"
"NBP wierzy w polską gospodarkę. Prognozuje wysoki wzrost","Gospodarka","0"
"Premier szacuje, że koszty obietnic wyborczych wyniosą 40 mld złotych","Gospodarka","0"
"PMI dla polskiego przemysłu najniższe od sześciu lat! Jeden z gorszych wyników w Europie","Gospodarka","0"
"Dane kwartalne PKB nieco gorsze niż dotychczas, ale na razie nie ma powodu do paniki","Gospodarka","0"
"Ruszył program ""Mama 4 plus"". Wiek niektórych kobiet jest imponujący","Gospodarka","0"
"Polska w trzydziestce krajów o największym dobrobycie. Musimy jednak popracować nad innowacyjnością","Gospodarka","0"
"Komisja Europejska chwali Polskę za wyniki gospodarcze, ale zauważa też potencjalne problemy","Gospodarka","0"
"Sprzedaż detaliczna wyraźnie w górę. Analitycy po raz kolejny nie trafili z danymi","Gospodarka","0"
"Warszawa to nie cała Polska i ten ranking to potwierdza","Gospodarka","0"
"Produkcja przemysłowa znacznie powyżej oczekiwań analityków","Gospodarka","0"
"Jednak jest nadzieja na polski grafen. Do gry wchodzi Grupa Azoty","Gospodarka","0"
"Bezrobocie w Polsce wynosi 3,5 proc., a nasz rynek pracy w szkole dostałby słabą tróję","Gospodarka","0"
"Dynamika PKB najniższa od półtora roku","Gospodarka","0"
"Spowolnienie w strefie euro mocno nie zaszkodzi Polsce","Gospodarka","0"
"Wzrost PKB powyżej oczekiwań analityków. Gospodarka rozwijała się najszybciej od 10 lat","Gospodarka","0"
"Polska z nierównościami dochodowymi na poziomie USA","Gospodarka","0"
"Ukraina ma nowego prezydenta!","Gospodarka","0"
"Większośc Ukraińców chce pracować i mieszkać w Polsce","Gospodarka","0"
"Kraje skandynawskie są bogate dzięki, a nie pomimo socjaldemokracji","Gospodarka","0"
"Finlandia otwiera nową kopalnie i zwiększa trzykrotnie wydobycie srebra","Gospodarka","0"
"W Europie ciągle niskie bezrobocie. Czesi z niespotykanym rezultatem","Gospodarka","0"
"W niemieckim przemyśle panują fatalne nastroje","Gospodarka","0"
"Maraton wyborczy u naszych sąsiadów. Wszyscy chcą bliższych relacji z UE","Gospodarka","0"
"Ukraińska gospodarka odnotowała najszybszy wzrost gospodarczy od 2011 roku","Gospodarka","0"
"Europa się starzeje, a wkrótce zacznie wymierać","Gospodarka","0"
"Turcja popadła w recesję pierwszy raz od światowego kryzysu gospodarczego","Gospodarka","0"
"Wzrost gospodarczy w 2018 roku. Wyraźne różnice w rozwoju Wschodu i Zachodu Europy","Gospodarka","0"
"Unia Europejska wprowadza quasi-wizy. Również dla Amerykanów","Gospodarka","0"
"Włochy ogarnięte recesją, Niemcy na jej skraju. Dane Eurostatu za IV kwartał 2018","Gospodarka","0"
"EBC nie podziela optymizmu NBP. Rewiduje swoje prognozy dla strefy euro","Gospodarka","0"
"Polska bogatsza od Portugalii. Jesteśmy świadkami gospodarczego przebiegunowania Europy","Gospodarka","0"
"Niemiecka gospodarka a sprawa polska","Gospodarka","0"
"Koniec ze zmianami czasu w UE. Najprawdopodobniej już w 2021 roku","Gospodarka","0"
"Ukraina na drodze do niezależności gazowej","Gospodarka","0"
"Bezrobocie w Polsce jedno z najniższych w UE. Kraje Południa na szarym końcu","Gospodarka","0"
"Niemiecka gospodarka znajduje się w bardzo specyficznej i niebezpiecznej sytuacji","Gospodarka","0"
"Niemcy tworzą nową strategię przemysłową","Gospodarka","0"
"Przed Ukrainą ciężki rok","Gospodarka","0"
"Niemcy znowu imponują. Odnotowały najwyższą nadwyżkę budżetową w historii","Gospodarka","0"
"Węgrzy chcą umarzać kredyty i znosić podatki. Wszystko w ramach polityki prorodzinnej","Gospodarka","0"
"Niemiecka gospodarka napędza handel w Unii Europejskiej i generuje potężne nadwyżki handlowe","Gospodarka","0"
"Macedonia bliska wstąpienia do NATO. Czy kolejnym krokiem będzie UE?","Gospodarka","0"
"Doświadczenia Czarnogóry z jednostronną euroizacją","Gospodarka","0"
"MFW podał prognozy wzrostu dla światowej gospodarki","Gospodarka","0"
"Komisja Europejska opublikowała nowe prognozy wzrostu PKB w UE","Gospodarka","0"
"Czekając na następny kryzys światowy","Gospodarka","0"
"Jak sukcesu na rynku ropy nie zamienić w międzynarodowy problem","Gospodarka","0"
"Czy kraje demokratyczne są demokratyczne?","Gospodarka","0"
"Nie ma rozwoju bez dobrego internetu","Gospodarka","0"
"Kazachstan zmienia nazwę stolicy. Na cześć wieloletniego prezydenta","Gospodarka","0"
"Amerykanie przyspieszają lot na Księżyc. Rozpoczęła się druga część Gwiezdnych Wojen","Gospodarka","0"
"Ceny nieruchomości w Chinach rosną w bardzo szybkim tempie. Istnieje ryzyko systemowe","Gospodarka","0"
"FED przewiduje w USA stosunkowo wysoki wzrost gospodarczy","Gospodarka","0"
"Turcja rozrabia na Bliskim Wschodzie i chce być lokalnym hegemonem","Gospodarka","0"
"Chiński smok łapie zadyszkę. Państwo Środka coraz mocniej odczuwa wojnę handlową","Gospodarka","0"
"Saga argentyńskiej inflacji","Gospodarka","0"
"W tym tygodniu czeka nas nawała danych gospodarczych ze świata","Gospodarka","0"
"OECD przedstawia negatywne prognozy dla światowej gospodarki","Gospodarka","0"
"Republika Południowej Afryki - kraj utraconych nadziei","Gospodarka","0"
"Chiny wdrażają swój plan społeczno - gospodarczy. Obniżają podatki i walczą z biedą","Gospodarka","0"
"Boliwia chce udowodnić, że socjalizm się sprawdza","Gospodarka","0"
"Wielka Brytania ma zwrócić bezprawnie zabrane wyspy, na których jest amerykańska baza","Gospodarka","0"
"Trump: Korea Północna nie ma żadnej gospodarczej przyszłości","Gospodarka","0"
"Armatorzy wysyłają puste tankowce przez Atlantyk, tylko po to żeby przejąć transporty ropy z USA","Gospodarka","0"
"Bangladesz kontra Indie i ich dwa odmienne modele rozwoju gospodarczego","Gospodarka","0"
"Zmienia się średnia długość życia. Brytyjczycy już wiedzą, kiedy mężczyźni dorównają kobietom","Gospodarka","0"
"Chiny rozpoczęły podbój kosmosu. Czy czeka nas kolejna część Gwiezdnych Wojen?","Gospodarka","0"
"Miliardy euro strat dla europejskiej gospodarki. Mocno może ucierpieć również Polska","Gospodarka","0"
"USA bije rekord zadłużenia. To jednak nic nie znaczy i nie niesie za sobą większych konsekwencji","Gospodarka","0"
"Czy Amerykanie uderzą w wenezuelską gospodarkę?","Gospodarka","0"
"UE zawarła umowę o wolnym handlu z Singapurem. Ta decyzje znosi praktycznie wszystkie cła","Gospodarka","0"
"Davos: Bomba długu na świecie nie tyka równomiernie","Gospodarka","0"
"Chiny liczą na utrzymanie dobrej dynamiki PKB w 2019 roku","Gospodarka","0"
"Kryzys finansowy 2008 roku wybuchł szybciej niż przypuszczamy","Gospodarka","0"
"Postulaty keynesizmu pod inną nazwą. Reaganomika to mit!","Gospodarka","0"
"Policja na zakupach! ""Pierwszy raz w historii oznakowanymi radiowozami będą BMW""","Transport i infrastruktura","0"
"Policja kupuje kolejne radiowozy. Po raz kolejny są to BMW","Transport i infrastruktura","0"
"Volkswagen został największym producentem samochodów w Polsce","Transport i infrastruktura","0"
"DCT Gdańsk atakuje europejski rynek. Nowi właściciele chcą zainwestować 2 mld złotych","Transport i infrastruktura","0"
"Wiemy dlaczego Policja zamówiła radiowozy w wersji sedan!","Transport i infrastruktura","0"
"Port Gdańsk największym portem kontenerowym na Bałtyku","Transport i infrastruktura","0"
"Port Gdańsk największym portem kontenerowym na Bałtyku","Transport i infrastruktura","0"
"Rekord za rekordem Lotniska Chopina, które coraz mocniej się zapycha","Transport i infrastruktura","0"
"Rok 2018 w polskim lotnictwie okazał się lepszy niż przewidywano","Transport i infrastruktura","0"
"Niemcy odraczają modernizację sił powietrznych. Nawet do 2030 roku","Transport i infrastruktura","0"
"Krakowskie lotnisko inwestuje ponad 1 miliard złotych w rozwój","Transport i infrastruktura","0"
"Londyn Heathrow obsługuje najbardziej oblegane trasy w Europie","Transport i infrastruktura","0"
"Turcja otwiera swoje CPK. Lotnisko da pracę ponad 200 tys. osób","Transport i infrastruktura","0"
"Francuzi i Chińczycy zawierają wielomiliardowe umowy. M.in. na zakup 300 samolotów","Transport i infrastruktura","0"
"LOT rozwija się w Krakowie i uruchamia kolejne połączenie","Transport i infrastruktura","0"
"Centralny Port Komunikacyjny zbuduje świadomość społeczna","Transport i infrastruktura","0"
"Polskie lotniska zaliczają awans w Top100 największych w Europie. Do czołówki jednak bardzo daleko","Transport i infrastruktura","0"
"Ryanair otwiera bazę w Katowicach i inwestuje 200 mln dolarów","Transport i infrastruktura","0"
"Dwa czołowe polskie lotniska w mocnym gazie. Rekordowe wyniki","Transport i infrastruktura","0"
"Koniec Superjumbo! Airbus zamyka produkcję swojego giganta","Transport i infrastruktura","0"
"Kupno przez Polskę myśliwca F35 to skarbonka bez dna","Transport i infrastruktura","0"
"Lotniska tranzytowe przynoszą gospodarce gigantyczne zyski. Czy tak będzie w przypadku CPK?","Transport i infrastruktura","0"
"Kolejne połączenie dalekodystansowe LOT. Tym razem polecimy na Sri Lankę","Transport i infrastruktura","0"
"Flota długodystansowa LOT się rozrasta. Na Lotnisku Chopina wylądował kolejny Dreamliner","Transport i infrastruktura","0"
"Papierek lakmusowy wzrostu gospodarczego! Coraz więcej Polaków lata samolotem","Transport i infrastruktura","0"
"Przy rozbudowie A2 będzie uwzględnione powstanie CPK","Transport i infrastruktura","0"
"Upada największy przewoźnik czarterowy w Polsce. Zyska na tym LOT","Transport i infrastruktura","0"
"Wystartowały roboty na A1. Pojedziemy z Gdańska do Czech w około 5 godzin","Transport i infrastruktura","0"
"W Polsce buduje się coraz więcej dróg z betonu","Transport i infrastruktura","0"
"A2 między Łodzią a Warszawą będzie miała trzy pasy w każdą stronę","Transport i infrastruktura","0"
"Rusza budowa kolejnego odcinka A1. Gierkówka stanie się autostradą z trzema pasami ruchu","Transport i infrastruktura","0"
"Pojedziemy z Gdańska do Warszawy 200 km/h – z dwuletnim opóźnieniem","Transport i infrastruktura","0"
"PKP IC zamierza uruchomić pociągi bezpośrednio na Lotnisko Chopina","Transport i infrastruktura","0"
"Kim nie chce pokazywać swoje zależności wobec Chin. Dlatego do Hanoi będzie jechał 3,5 dnia","Transport i infrastruktura","0"
"Przewozy Regionalne odżywają. Ponad 50 mln złotych na plusie","Transport i infrastruktura","0"
"Tunel kością niezgody we włoskim rządzie. W tle pogarszające się relacje z Francją","Transport i infrastruktura","0"
"Pociągi wracają do łask. Coraz lepsze statystyki kolei","Transport i infrastruktura","0"
"Kolejny drapacz chmur w Warszawie? Wiele wskazuje na to, że czeka nas spowolnienie gospodarcze","Transport i infrastruktura","0"
"W Danii ma powstać najwyższy budynek w UE. Praktycznie pośrodku niczego","Transport i infrastruktura","0"
"W Warszawie szykuje się kolejny drapacz chmur. Czyżby inwestycja JP Morgan?","Transport i infrastruktura","0"
"Na Mennicy zawisła wiecha, a deweloper szykuje się do sprzedaży wieżowca","Transport i infrastruktura","0"
"Warszawa w budowie! W centrum powstanie kolejny wieżowiec [Wizualizacje]","Transport i infrastruktura","0"
"Duże zamówienie Arrivy. Pierwsze ""gazowce"" Solarisa w Warszawie","Transport i infrastruktura","0"
"Gigantyczny przetarg tramwajowy dla Warszawy rozstrzygnięty!","Transport i infrastruktura","0"
"Pierwszy autonomiczny autobus elektryczny Volvo","Transport i infrastruktura","0"
"Rząd obniża podatki wprowadzając nową stawkę PIT","Finanse","0"
"Dobre wyniki warszawskiego parkietu. Najwyższe poziomy od ponad roku","Finanse","0"
"500+ niesie więcej korzyści niż się może wydawać","Finanse","0"
"Nowe technologie odgrywają coraz większa rolę w bankowości","Finanse","0"
"Giełda w Hongkongu stała się nr 3 na świecie","Finanse","0"
"Szwajcarski bank zainwestuje w Krakowie co najmniej 90 mln złotych","Finanse","0"
"Szwajcarski bank zainwestuje w Krakowie co najmniej 90 mln złotych","Finanse","0"
"Minister finansów zapowiada ""mniej zbilansowany"" budżet i pobudzanie gospodarki","Finanse","0"
"NBP ujawnił zarobki Prezesów w latach 1995-2018. Są duże dysproporcje","Finanse","0"
"Polska chce być przyjazna dla małych przedsiębiorców","Finanse","0"
"Rajd CD Projekt na giełdzie. Zwiększył swoją wartość o 1 mld złotych w ciągu kilku godzin","Finanse","0"
"Rząd nie pomaga mikroprzedsiębiorcom? Zmiany w prawie 2018 okiem małego biznesu","Finanse","0"
"Pogłoski stały się faktem! Fuzja Commerzbanku i Deutsche Banku coraz bliżej","Finanse","0"
"Uszczelnienie luki VAT sfinansowało 500+","Finanse","0"
"PiS wspiera WOŚP w biciu kolejnych rekordów","Finanse","0"
"Deficyt budżetowy w 2020 roku może przekroczyć 2 proc. PKB","Finanse","0"
"Koniec bismarckowskiego modelu emerytur","Finanse","0"
"Złoto najniżej od stycznia. Wszystko za sprawą Chin i USA","Finanse","0"
"Rząd obniża podatki. Chce zwiększyć progresywność systemu podatkowego","Finanse","0"
"Premier League jest przykładem na to, że pieniądze nie do końca idą w parze z sukcesami w sporcie","Finanse","0"
"Płace minimalne w pogoni za średnimi","Finanse","0"
"Na co amerykańskie korporacje powinny wydawać swoją gotówkę? [2/2]","Finanse","0"
"ZUS podaje emerytalnych rekordzistów. Najwyższe świadczenie to ponad 20 tys. zł miesięcznie","Finanse","0"
"Po Brexicie żadne europejskie miasto nie będzie dla finansów drugim Londynem","Finanse","0"
"Na co amerykańskie korporacje powinny wydawać swoją gotówkę? [1/2]","Finanse","0"
"Emerytury i renty w górę. Szczególnie wzrośnie emerytura minimalna","Finanse","0"
"Zaledwie 18 proc. Polaków uważa opłacanie składek ZUS za dobry sposób oszczędzania na emeryturę","Finanse","0"
"Nadal są liczone koszty likwidacji banku Lehman Brothers","Finanse","0"
"Walka o podatek – Polska kontra Unia Europejska","Finanse","0"
"""Deficyt budżetu państwa wyniósł 10,4 mld zł""","Finanse","0"
"Czekają nas niskie emerytury. Lepiej pomyśleć o nich samemu","Finanse","0"
"Brytyjczycy zapewniają bankierów, że twardy Brexit nie będzie dla nich problematyczny","Finanse","0"
